{
  "schemaVersion": "1.0",
  "kind": "loopengineer.dispatchTable",
  "table_id": "dispatch-18-a",
  "version": {
    "productVersion": "0.1.0",
    "protocolVersion": "1",
    "schemaVersion": "1.0",
    "skillContractVersion": "1"
  },
  "scheduler_id": "scheduler-18",
  "created_at": "2026-06-15T09:30:00Z",
  "state_root": ".loopengineer/state/issue-18",
  "entries": [
    {
      "instruction_id": "instruction-18-a",
      "unit_id": "unit-report-schema",
      "worker_id": "worker-18-a",
      "status": "instruction-sent-awaiting-ack",
      "expected_report_type": "instruction_ack",
      "report_output_path": ".loopengineer/state/issue-18/reports/report-worker-18-ack.json",
      "report_to_thread_id": "thread-scheduler-18",
      "assigned_scope": [
        "schemas/v1/report.schema.json",
        "schemas/v1/examples/report.valid.json"
      ],
      "next_action": {
        "owner": "scheduler",
        "action": "consume instruction_ack report before marking active",
        "status": "required"
      }
    }
  ],
  "next_action": {
    "owner": "scheduler",
    "action": "wait for report locator",
    "status": "waiting"
  }
}
